{
  "schema_name": "governed-ai-skill-registry",
  "schema_version": "1.0.0",
  "registry_version": 7,
  "entries": [
    {
      "entry_id": "govern-ai-skill-packaging-and-deployment@1.0.0",
      "skill_name": "govern-ai-skill-packaging-and-deployment",
      "version": "1.0.0",
      "owning_repository": {
        "repository_id": "jesse5656/jryanrussow-site",
        "repository_name": "jesse5656/jryanrussow-site",
        "commit": "77d2fb7bd4dc8371f96c44ad47cd7d00e3a02635"
      },
      "release_reference": "docs/architecture/ai-skills/releases/govern-ai-skill-packaging-and-deployment/1.0.0/release.json",
      "artifact": {
        "storage_mode": "REPOSITORY_FILE",
        "location": "artifacts/ai-skills/govern-ai-skill-packaging-and-deployment/1.0.0/govern-ai-skill-packaging-and-deployment-v1.0.0.zip",
        "sha256": "795af431af4f08c850a2bf38ee88b0e999959d09596bda4a417be7902c969e46",
        "byte_size": 24024,
        "format": "zip"
      },
      "validation": {
        "status": "VALIDATED_PRODUCTION",
        "reference": "docs/architecture/ai-skills/releases/govern-ai-skill-packaging-and-deployment/1.0.0/evidence/run-01/evaluator-report.json"
      },
      "production_baseline_reference": "docs/architecture/ai-skills/releases/govern-ai-skill-packaging-and-deployment/1.0.0/PRODUCTION-BASELINE.md",
      "supported_runtimes": [
        {
          "runtime_class": "CODEX_LOCAL_AGENT_SKILLS",
          "support_status": "PLANNED",
          "adapter_id": null
        },
        {
          "runtime_class": "AI_WORKER_NODE",
          "support_status": "PLANNED",
          "adapter_id": null
        },
        {
          "runtime_class": "API_ORCHESTRATION",
          "support_status": "PLANNED",
          "adapter_id": null
        },
        {
          "runtime_class": "CHATGPT_SKILLS",
          "support_status": "UNKNOWN",
          "adapter_id": null
        },
        {
          "runtime_class": "OTHER_GOVERNED_RUNTIME",
          "support_status": "UNKNOWN",
          "adapter_id": null
        }
      ],
      "dependencies": [],
      "deployment_targets": [],
      "rollback_predecessor": null
    },
    {
      "entry_id": "evaluate-business-capability-architecture@1.0.0",
      "skill_name": "evaluate-business-capability-architecture",
      "version": "1.0.0",
      "owning_repository": {
        "repository_id": "jesse5656/mwg-ops-manual",
        "repository_name": "jesse5656/mwg-ops-manual",
        "commit": "53c67a91d5c50600efca71d59da5e21a5cc2cf91"
      },
      "release_reference": "docs/architecture/ai-skills/releases/evaluate-business-capability-architecture/1.0.0/release.json",
      "artifact": {
        "storage_mode": "REPOSITORY_FILE",
        "location": "artifacts/ai-skills/evaluate-business-capability-architecture/1.0.0/evaluate-business-capability-architecture-v1.0.0.zip",
        "sha256": "ac6eb6cf13f2b6beca1113621414bdb8e81224136030598e16109eb1b138c34d",
        "byte_size": 23446,
        "format": "zip"
      },
      "validation": {
        "status": "VALIDATED_PRODUCTION",
        "reference": "02-Operations/Business-Capability-Catalog/governance/ai-skills/evaluate-business-capability-architecture/1.0.0/RUNTIME-VALIDATION-DECISION-V1.md"
      },
      "production_baseline_reference": "02-Operations/Business-Capability-Catalog/governance/ai-skills/evaluate-business-capability-architecture/1.0.0/PRODUCTION-BASELINE.md",
      "supported_runtimes": [
        {
          "runtime_class": "CODEX_LOCAL_AGENT_SKILLS",
          "support_status": "PLANNED",
          "adapter_id": null
        },
        {
          "runtime_class": "AI_WORKER_NODE",
          "support_status": "PLANNED",
          "adapter_id": null
        },
        {
          "runtime_class": "API_ORCHESTRATION",
          "support_status": "PLANNED",
          "adapter_id": null
        },
        {
          "runtime_class": "CHATGPT_SKILLS",
          "support_status": "UNKNOWN",
          "adapter_id": null
        },
        {
          "runtime_class": "OTHER_GOVERNED_RUNTIME",
          "support_status": "UNKNOWN",
          "adapter_id": null
        }
      ],
      "dependencies": [],
      "deployment_targets": [],
      "rollback_predecessor": null
    },
    {
      "entry_id": "process-property-records@1.1.0",
      "skill_name": "process-property-records",
      "version": "1.1.0",
      "owning_repository": {
        "repository_id": "jesse5656/mwg-ops-manual",
        "repository_name": "jesse5656/mwg-ops-manual",
        "commit": "376d0ba760dee00179f7467f8aadf191caa11151"
      },
      "release_reference": "docs/architecture/ai-skills/releases/process-property-records/1.1.0/release.json",
      "artifact": {
        "storage_mode": "REPOSITORY_FILE",
        "location": "artifacts/ai-skills/process-property-records/1.1.0/process-property-records-v1.1.0.zip",
        "sha256": "769752ef857cd048fa2a7cb0f3c95c29995abf897adba8f00f88d591404b1052",
        "byte_size": 54954,
        "format": "zip"
      },
      "validation": {
        "status": "VALIDATED_PRODUCTION",
        "reference": "docs/operations/property-records-skill/process-property-records-v1.1-regression-decision.md"
      },
      "production_baseline_reference": "artifacts/ai-skills/process-property-records/1.1.0/evidence/PRODUCTION-BASELINE.md",
      "supported_runtimes": [
        {
          "runtime_class": "CODEX_LOCAL_AGENT_SKILLS",
          "support_status": "PLANNED",
          "adapter_id": null
        },
        {
          "runtime_class": "AI_WORKER_NODE",
          "support_status": "PLANNED",
          "adapter_id": null
        },
        {
          "runtime_class": "API_ORCHESTRATION",
          "support_status": "PLANNED",
          "adapter_id": null
        },
        {
          "runtime_class": "CHATGPT_SKILLS",
          "support_status": "UNKNOWN",
          "adapter_id": null
        },
        {
          "runtime_class": "OTHER_GOVERNED_RUNTIME",
          "support_status": "UNKNOWN",
          "adapter_id": null
        }
      ],
      "dependencies": [],
      "deployment_targets": [],
      "rollback_predecessor": null
    },
    {
      "entry_id": "write-midwestguard-blog-post@1.0.0",
      "skill_name": "write-midwestguard-blog-post",
      "version": "1.0.0",
      "owning_repository": {
        "repository_id": "jesse5656/mwg-ops-manual",
        "repository_name": "jesse5656/mwg-ops-manual",
        "commit": "9b3fee26baaad1a8788e8ad1e34c6d38c8ad5b09"
      },
      "release_reference": "docs/architecture/ai-skills/releases/write-midwestguard-blog-post/1.0.0/release.json",
      "artifact": {
        "storage_mode": "REPOSITORY_FILE",
        "location": "artifacts/ai-skills/write-midwestguard-blog-post/1.0.0/write-midwestguard-blog-post-v1.0.0.zip",
        "sha256": "c14cec6ca4e4757f5e881bfb5362660adcf7fb5f66759a18ace42f5a2e0b9e68",
        "byte_size": 18409,
        "format": "zip"
      },
      "validation": {
        "status": "VALIDATED_PRODUCTION",
        "reference": "artifacts/ai-skills/write-midwestguard-blog-post/1.0.0/evidence/VALIDATION-RECORD.md"
      },
      "production_baseline_reference": "artifacts/ai-skills/write-midwestguard-blog-post/1.0.0/evidence/PRODUCTION-BASELINE.md",
      "supported_runtimes": [
        {
          "runtime_class": "CODEX_LOCAL_AGENT_SKILLS",
          "support_status": "PLANNED",
          "adapter_id": null
        },
        {
          "runtime_class": "AI_WORKER_NODE",
          "support_status": "PLANNED",
          "adapter_id": null
        },
        {
          "runtime_class": "API_ORCHESTRATION",
          "support_status": "PLANNED",
          "adapter_id": null
        },
        {
          "runtime_class": "CHATGPT_SKILLS",
          "support_status": "UNKNOWN",
          "adapter_id": null
        },
        {
          "runtime_class": "OTHER_GOVERNED_RUNTIME",
          "support_status": "UNKNOWN",
          "adapter_id": null
        }
      ],
      "dependencies": [],
      "deployment_targets": [],
      "rollback_predecessor": null
    },
    {
      "entry_id": "handoff-governed-work@1.0.0",
      "skill_name": "handoff-governed-work",
      "version": "1.0.0",
      "owning_repository": {
        "repository_id": "jesse5656/jryanrussow-site",
        "repository_name": "jesse5656/jryanrussow-site",
        "commit": "36025587a4bc847054ff39c3d1c2b742f8d70e43"
      },
      "release_reference": "docs/architecture/ai-skills/releases/handoff-governed-work/1.0.0/release.json",
      "artifact": {
        "storage_mode": "REPOSITORY_FILE",
        "location": "artifacts/ai-skills/handoff-governed-work/1.0.0/handoff-governed-work-v1.0.0.zip",
        "sha256": "77495774c0b2888ef4e3aa047454aff03f358cf37a93fe4ab97e0eee07dec99d",
        "byte_size": 7023,
        "format": "zip"
      },
      "validation": {
        "status": "VALIDATED_PRODUCTION",
        "reference": "docs/architecture/HANDOFF-GOVERNED-WORK-V1.0-VALIDATION-RECORD.md"
      },
      "production_baseline_reference": "docs/architecture/HANDOFF-GOVERNED-WORK-V1.0-PRODUCTION-BASELINE.md",
      "supported_runtimes": [
        {
          "runtime_class": "CODEX_LOCAL_AGENT_SKILLS",
          "support_status": "PLANNED",
          "adapter_id": null
        },
        {
          "runtime_class": "AI_WORKER_NODE",
          "support_status": "PLANNED",
          "adapter_id": null
        },
        {
          "runtime_class": "API_ORCHESTRATION",
          "support_status": "PLANNED",
          "adapter_id": null
        },
        {
          "runtime_class": "CHATGPT_SKILLS",
          "support_status": "UNKNOWN",
          "adapter_id": null
        },
        {
          "runtime_class": "OTHER_GOVERNED_RUNTIME",
          "support_status": "UNKNOWN",
          "adapter_id": null
        }
      ],
      "dependencies": [],
      "deployment_targets": [],
      "rollback_predecessor": null
    },
    {